[
  {
    "schemaVersion": "solver-evaluation-case-v1",
    "id": "algebra",
    "revision": 1,
    "family": "algebra",
    "partition": "REGRESSION",
    "origin": {
      "type": "PROJECT_AUTHORED_SYNTHETIC",
      "author": "verified-ai-sprint-5.12",
      "license": "PROJECT_EVALUATION_ONLY",
      "rightsStatus": "SYNTHETIC_PROJECT_AUTHORED",
      "trainingEligibility": "NOT_ELIGIBLE"
    },
    "problemClass": "ALGEBRA",
    "locale": "en-US",
    "modality": "TEXT",
    "difficulty": "STANDARD",
    "canonicalSupport": "SUPPORTED",
    "input": "Expand 2*(x+1)",
    "slices": [
      "ALGEBRA",
      "EN",
      "TEXT",
      "STANDARD",
      "PARTITION_REGRESSION",
      "SUPPORT_SUPPORTED",
      "SCOPE_FINAL_ANSWER"
    ],
    "contracts": [
      "solution-candidate-v1",
      "verification-decision-v1",
      "verification-policy-v1"
    ],
    "expected": {
      "disposition": "CANDIDATE",
      "answer": "2*x+2",
      "verification": "VERIFIED",
      "scope": "FINAL_ANSWER",
      "scopeDetail": null,
      "uncertainty": false,
      "labelBasis": "SYNTHETIC_AUTHOR_JUDGMENT",
      "rationale": "Distributivity over the real numbers.",
      "independentReview": false
    }
  },
  {
    "schemaVersion": "solver-evaluation-case-v1",
    "id": "ambiguous",
    "revision": 1,
    "family": "ambiguous",
    "partition": "HARD_TAIL",
    "origin": {
      "type": "PROJECT_AUTHORED_SYNTHETIC",
      "author": "verified-ai-sprint-5.12",
      "license": "PROJECT_EVALUATION_ONLY",
      "rightsStatus": "SYNTHETIC_PROJECT_AUTHORED",
      "trainingEligibility": "NOT_ELIGIBLE"
    },
    "problemClass": "AMBIGUOUS",
    "locale": "en-US",
    "modality": "TEXT",
    "difficulty": "HARD_TAIL",
    "canonicalSupport": "REVIEW_REQUIRED",
    "input": "Is the source x+1 or x-1?",
    "slices": [
      "AMBIGUOUS",
      "EN",
      "TEXT",
      "HARD_TAIL",
      "PARTITION_HARD_TAIL",
      "SUPPORT_REVIEW_REQUIRED",
      "SCOPE_NONE"
    ],
    "contracts": [
      "solution-candidate-v1",
      "verification-decision-v1",
      "verification-policy-v1"
    ],
    "expected": {
      "disposition": "REVIEW",
      "answer": null,
      "verification": "UNVERIFIED",
      "scope": "NONE",
      "scopeDetail": null,
      "uncertainty": true,
      "labelBasis": "SYNTHETIC_AUTHOR_JUDGMENT",
      "rationale": "Source correction is required before solving.",
      "independentReview": false
    }
  },
  {
    "schemaVersion": "solver-evaluation-case-v1",
    "id": "arithmetic",
    "revision": 1,
    "family": "arithmetic",
    "partition": "DEVELOPMENT",
    "origin": {
      "type": "PROJECT_AUTHORED_SYNTHETIC",
      "author": "verified-ai-sprint-5.12",
      "license": "PROJECT_EVALUATION_ONLY",
      "rightsStatus": "SYNTHETIC_PROJECT_AUTHORED",
      "trainingEligibility": "NOT_ELIGIBLE"
    },
    "problemClass": "ARITHMETIC",
    "locale": "en-US",
    "modality": "TEXT",
    "difficulty": "STANDARD",
    "canonicalSupport": "SUPPORTED",
    "input": "2+3",
    "slices": [
      "ARITHMETIC",
      "EN",
      "TEXT",
      "STANDARD",
      "PARTITION_DEVELOPMENT",
      "SUPPORT_SUPPORTED",
      "SCOPE_FINAL_ANSWER"
    ],
    "contracts": [
      "solution-candidate-v1",
      "verification-decision-v1",
      "verification-policy-v1"
    ],
    "expected": {
      "disposition": "CANDIDATE",
      "answer": "5",
      "verification": "VERIFIED",
      "scope": "FINAL_ANSWER",
      "scopeDetail": null,
      "uncertainty": false,
      "labelBasis": "SYNTHETIC_AUTHOR_JUDGMENT",
      "rationale": "Five is the exact integer sum.",
      "independentReview": false
    }
  },
  {
    "schemaVersion": "solver-evaluation-case-v1",
    "id": "calculus-scope",
    "revision": 1,
    "family": "calculus-scope",
    "partition": "HARD_TAIL",
    "origin": {
      "type": "PROJECT_AUTHORED_SYNTHETIC",
      "author": "verified-ai-sprint-5.12",
      "license": "PROJECT_EVALUATION_ONLY",
      "rightsStatus": "SYNTHETIC_PROJECT_AUTHORED",
      "trainingEligibility": "NOT_ELIGIBLE"
    },
    "problemClass": "CALCULUS_SCOPE",
    "locale": "en-US",
    "modality": "TEXT",
    "difficulty": "HARD_TAIL",
    "canonicalSupport": "SUPPORTED",
    "input": "Proof on (0,2) presented as all-real proof",
    "slices": [
      "CALCULUS_SCOPE",
      "EN",
      "TEXT",
      "HARD_TAIL",
      "PARTITION_HARD_TAIL",
      "SUPPORT_SUPPORTED",
      "SCOPE_NONE"
    ],
    "contracts": [
      "solution-candidate-v2",
      "verification-decision-v1",
      "verification-policy-v1"
    ],
    "expected": {
      "disposition": "CANDIDATE",
      "answer": null,
      "verification": "UNVERIFIED",
      "scope": "NONE",
      "scopeDetail": null,
      "uncertainty": true,
      "labelBasis": "SYNTHETIC_AUTHOR_JUDGMENT",
      "rationale": "Interval-scoped evidence cannot widen the mathematical claim.",
      "independentReview": false
    }
  },
  {
    "schemaVersion": "solver-evaluation-case-v1",
    "id": "contradiction",
    "revision": 1,
    "family": "contradiction",
    "partition": "HARD_TAIL",
    "origin": {
      "type": "PROJECT_AUTHORED_SYNTHETIC",
      "author": "verified-ai-sprint-5.12",
      "license": "PROJECT_EVALUATION_ONLY",
      "rightsStatus": "SYNTHETIC_PROJECT_AUTHORED",
      "trainingEligibility": "NOT_ELIGIBLE"
    },
    "problemClass": "CONTRADICTION",
    "locale": "en-US",
    "modality": "TEXT",
    "difficulty": "HARD_TAIL",
    "canonicalSupport": "SUPPORTED",
    "input": "Candidate says 2+2=5",
    "slices": [
      "CONTRADICTION",
      "EN",
      "TEXT",
      "HARD_TAIL",
      "PARTITION_HARD_TAIL",
      "SUPPORT_SUPPORTED",
      "SCOPE_NONE"
    ],
    "contracts": [
      "solution-candidate-v1",
      "verification-decision-v1",
      "verification-policy-v1"
    ],
    "expected": {
      "disposition": "CANDIDATE",
      "answer": null,
      "verification": "UNVERIFIED",
      "scope": "NONE",
      "scopeDetail": null,
      "uncertainty": true,
      "labelBasis": "SYNTHETIC_AUTHOR_JUDGMENT",
      "rationale": "Exact arithmetic contradicts the candidate.",
      "independentReview": false
    }
  },
  {
    "schemaVersion": "solver-evaluation-case-v1",
    "id": "derivative",
    "revision": 1,
    "family": "derivative",
    "partition": "REGRESSION",
    "origin": {
      "type": "PROJECT_AUTHORED_SYNTHETIC",
      "author": "verified-ai-sprint-5.12",
      "license": "PROJECT_EVALUATION_ONLY",
      "rightsStatus": "SYNTHETIC_PROJECT_AUTHORED",
      "trainingEligibility": "NOT_ELIGIBLE"
    },
    "problemClass": "CALCULUS",
    "locale": "en-US",
    "modality": "TEXT",
    "difficulty": "STANDARD",
    "canonicalSupport": "SUPPORTED",
    "input": "d/dx x^2 on (0,2)",
    "slices": [
      "CALCULUS",
      "EN",
      "TEXT",
      "STANDARD",
      "PARTITION_REGRESSION",
      "SUPPORT_SUPPORTED",
      "SCOPE_OPEN_INTERVAL"
    ],
    "contracts": [
      "solution-candidate-v2",
      "verification-decision-v1",
      "verification-policy-v1"
    ],
    "expected": {
      "disposition": "CANDIDATE",
      "answer": "2*x",
      "verification": "VERIFIED",
      "scope": "OPEN_INTERVAL",
      "scopeDetail": "0<x<2",
      "uncertainty": false,
      "labelBasis": "SYNTHETIC_AUTHOR_JUDGMENT",
      "rationale": "Polynomial derivative on the declared open interval.",
      "independentReview": false
    }
  },
  {
    "schemaVersion": "solver-evaluation-case-v1",
    "id": "disagreement",
    "revision": 1,
    "family": "disagreement",
    "partition": "HARD_TAIL",
    "origin": {
      "type": "PROJECT_AUTHORED_SYNTHETIC",
      "author": "verified-ai-sprint-5.12",
      "license": "PROJECT_EVALUATION_ONLY",
      "rightsStatus": "SYNTHETIC_PROJECT_AUTHORED",
      "trainingEligibility": "NOT_ELIGIBLE"
    },
    "problemClass": "DISAGREEMENT",
    "locale": "en-US",
    "modality": "TEXT",
    "difficulty": "HARD_TAIL",
    "canonicalSupport": "SUPPORTED",
    "input": "Independent solvers disagree on x+1=2",
    "slices": [
      "DISAGREEMENT",
      "EN",
      "TEXT",
      "HARD_TAIL",
      "PARTITION_HARD_TAIL",
      "SUPPORT_SUPPORTED",
      "SCOPE_NONE"
    ],
    "contracts": [
      "solution-candidate-v1",
      "verification-decision-v1",
      "verification-policy-v1"
    ],
    "expected": {
      "disposition": "CANDIDATE",
      "answer": null,
      "verification": "UNVERIFIED",
      "scope": "NONE",
      "scopeDetail": null,
      "uncertainty": true,
      "labelBasis": "SYNTHETIC_AUTHOR_JUDGMENT",
      "rationale": "Disagreement needs reconciliation, not majority verification.",
      "independentReview": false
    }
  },
  {
    "schemaVersion": "solver-evaluation-case-v1",
    "id": "domain",
    "revision": 1,
    "family": "domain",
    "partition": "REGRESSION",
    "origin": {
      "type": "PROJECT_AUTHORED_SYNTHETIC",
      "author": "verified-ai-sprint-5.12",
      "license": "PROJECT_EVALUATION_ONLY",
      "rightsStatus": "SYNTHETIC_PROJECT_AUTHORED",
      "trainingEligibility": "NOT_ELIGIBLE"
    },
    "problemClass": "DOMAIN",
    "locale": "en-US",
    "modality": "TEXT",
    "difficulty": "STANDARD",
    "canonicalSupport": "SUPPORTED",
    "input": "Simplify (x^2-1)/(x-1), x!=1",
    "slices": [
      "DOMAIN",
      "EN",
      "TEXT",
      "STANDARD",
      "PARTITION_REGRESSION",
      "SUPPORT_SUPPORTED",
      "SCOPE_FINAL_ANSWER"
    ],
    "contracts": [
      "solution-candidate-v1",
      "verification-decision-v1",
      "verification-policy-v1"
    ],
    "expected": {
      "disposition": "CANDIDATE",
      "answer": "x+1; x!=1",
      "verification": "VERIFIED",
      "scope": "FINAL_ANSWER",
      "scopeDetail": "x!=1",
      "uncertainty": false,
      "labelBasis": "SYNTHETIC_AUTHOR_JUDGMENT",
      "rationale": "Cancellation preserves the excluded point x=1.",
      "independentReview": false
    }
  },
  {
    "schemaVersion": "solver-evaluation-case-v1",